{
  "schema": "ao.atlas.run-link-schema-coverage.v0.1",
  "status": "complete",
  "evidence_root": "docs/evidence/ao-atlas-feature-depth-followup-durability-wave-v01",
  "run_link_count": 6,
  "completed_run_links": 6,
  "schema_counts": {
    "ao.atlas.run-link.v0.1": 6
  },
  "validator_counts": {
    "typed:run-link": 6
  },
  "entries": [
    {
      "path": "nodes/mission-recommendation-feature-depth-next-wave-01/run-link.json",
      "task_id": "mission-recommendation-feature-depth-next-wave-01-task",
      "status": "completed",
      "schema": "ao.atlas.run-link.v0.1",
      "validator": "typed:run-link",
      "evidence_key_count": 13,
      "digest": "sha256:f0b5a8354ae52122aee301dae915c1626a7e1feb0dcfba2a6e0d8a7961635395"
    },
    {
      "path": "nodes/mission-recommendation-feature-depth-next-wave-02/run-link.json",
      "task_id": "mission-recommendation-feature-depth-next-wave-02-task",
      "status": "completed",
      "schema": "ao.atlas.run-link.v0.1",
      "validator": "typed:run-link",
      "evidence_key_count": 13,
      "digest": "sha256:cd328e5ed4775248ba4d05c1e943ec80b0623378b83767d541b89a85ce6a1ca0"
    },
    {
      "path": "nodes/mission-recommendation-feature-depth-next-wave-03/run-link.json",
      "task_id": "mission-recommendation-feature-depth-next-wave-03-task",
      "status": "completed",
      "schema": "ao.atlas.run-link.v0.1",
      "validator": "typed:run-link",
      "evidence_key_count": 13,
      "digest": "sha256:ed630147142474432f57eaea45bfdcf7d1529f7f01502bffbb11c866413f4d37"
    },
    {
      "path": "nodes/mission-recommendation-feature-depth-next-wave-04/run-link.json",
      "task_id": "mission-recommendation-feature-depth-next-wave-04-task",
      "status": "completed",
      "schema": "ao.atlas.run-link.v0.1",
      "validator": "typed:run-link",
      "evidence_key_count": 13,
      "digest": "sha256:187f5984e07db3346d009414c02dbb4f0487e6e26eac8b0f49ea2a6f2ac39176"
    },
    {
      "path": "nodes/mission-recommendation-feature-depth-next-wave-05/run-link.json",
      "task_id": "mission-recommendation-feature-depth-next-wave-05-task",
      "status": "completed",
      "schema": "ao.atlas.run-link.v0.1",
      "validator": "typed:run-link",
      "evidence_key_count": 13,
      "digest": "sha256:f14f5222e9b930a27be7774ceb15e5861575c10a8710ec176df83d2f5f4dec70"
    },
    {
      "path": "nodes/mission-recommendation-feature-depth-next-wave-06/run-link.json",
      "task_id": "mission-recommendation-feature-depth-next-wave-06-task",
      "status": "completed",
      "schema": "ao.atlas.run-link.v0.1",
      "validator": "typed:run-link",
      "evidence_key_count": 13,
      "digest": "sha256:d96ed3d6f323b8a1efe729a2ed796ac764cea0a8344f4c5cf9a0bb95775c9bf0"
    }
  ],
  "schedules_work": false,
  "executes_work": false,
  "approves_work": false,
  "claims_authority_advance": false,
  "rsi_remains_denied": true
}
